{
  "source": "UPI<coding_theory,1,root_system,e8_coxeter_plane>",
  "target": "UPI<coding_theory,1,root_system,e8_weyl_group>",
  "relation": "DERIVED_FROM",
  "status": "DER",
  "mechanism": "A Coxeter element of W(E8) rotates a unique (up to W-action) plane by 2pi/30. Orthogonal projection onto that plane is the portrait.",
  "equations": [
    "c^30 = 1",
    "angle(c|plane) = 2pi/30"
  ],
  "assumptions": [
    "Coxeter element is the product of one simple reflection per Dynkin node."
  ],
  "confusion_guard": "The plane is a drawing aid. It is not a physical slice and not a dual of m = hf/c^2.",
  "version": "0.1.1",
  "evidence": [
    {
      "type": "other",
      "source": "Humphreys, Reflection Groups and Coxeter Groups; see linked UPI node definitions at commit 2aa811bf9594a8b4aae06287fa800e65c7f4aa57",
      "notes": "Mathematical definition chain; no physical equivalence or experimental verification asserted."
    }
  ]
}
