{
  "assumptions": [
    "A CSS construction is declared. G24 is self-dual, so it can serve as both C1 and C2 under the usual inclusion conditions."
  ],
  "relation": "DERIVED_FROM",
  "equations": [
    "CSS(G24, G24) uses the classical parity checks of G24 as stabilizer generators"
  ],
  "target": "UPI<coding_theory,1,binary_code,extended_golay>",
  "version": "0.1.0",
  "mechanism": "Measuring the classical Golay parity checks as Pauli operators yields a syndrome; the Golay decoder proposes a recovery.",
  "status": "DER",
  "confusion_guard": "Availability of the classical decoder does not imply a physical Golay CSS qubit has been built.",
  "source": "UPI<quantum_information,1,error_correction,syndrome_measurement>"
}
